<?xml version="1.0" encoding="UTF-8"?>
<xs:schema xmlns:xs="http://www.w3.org/2001/XMLSchema"
    xmlns:vc="http://www.w3.org/2007/XMLSchema-versioning" elementFormDefault="qualified"
    vc:minVersion="1.1" targetNamespace="http://www.ftn.uns.ac.rs/izvestaj_o_imunizaciji"
    xmlns="http://www.ftn.uns.ac.rs/izvestaj_o_imunizaciji">

    <xs:element name="izvestaj_o_imunizaciji">
        <xs:complexType>
            <xs:sequence>
                <xs:element name="period">
                    <xs:complexType>
                        <xs:sequence>
                            <xs:element name="od" type="xs:date"/>
                            <xs:element name="do" type="xs:date"/>
                        </xs:sequence>
                    </xs:complexType>
                </xs:element>
                <xs:element name="broj_interesovanja_o_imunizaciji">
                    <xs:simpleType>
                        <xs:restriction base="xs:integer">
                            <xs:minInclusive value="0"/>
                        </xs:restriction>
                    </xs:simpleType>
                </xs:element>
                <xs:element name="broj_zahteva_za_digiatlni_sertifikat">
                    <xs:simpleType>
                        <xs:restriction base="xs:integer">
                            <xs:minInclusive value="0"/>
                        </xs:restriction>
                    </xs:simpleType>
                </xs:element>
                <xs:element name="broj_izdatih_digitalnih_sertifikata">
                    <xs:simpleType>
                        <xs:restriction base="xs:integer">
                            <xs:minInclusive value="0"/>
                        </xs:restriction>
                    </xs:simpleType>
                </xs:element>
                <xs:element name="broj_primljenih_doza_vakcina">
                    <xs:simpleType>
                        <xs:restriction base="xs:integer">
                            <xs:minInclusive value="0"/>
                        </xs:restriction>
                    </xs:simpleType>
                </xs:element>
                <xs:element name="broj_novo_vakcinisanih">
                    <xs:simpleType>
                        <xs:restriction base="xs:integer">
                            <xs:minInclusive value="0"/>
                        </xs:restriction>
                    </xs:simpleType>
                </xs:element>
                <xs:element name="raspodela_proizvodjaca">
                    <xs:complexType>
                        <xs:sequence>
                            <xs:element maxOccurs="unbounded" name="vakcina">
                                <xs:complexType>
                                    <xs:simpleContent>
                                        <xs:extension base="xs:integer">
                                            <xs:attribute name="tip" type="xs:string"/>
                                        </xs:extension>
                                    </xs:simpleContent>
                                </xs:complexType>
                            </xs:element>
                        </xs:sequence>
                    </xs:complexType>
                </xs:element>
                <xs:element name="datum_izdavanja" type="xs:date"/>
            </xs:sequence>
        </xs:complexType>
    </xs:element>
</xs:schema>
